{
  "version": 2,
  "studentId": "denis_ermolaev",
  "studentName": "Денис Ермолаев",
  "program": "Математика",
  "planning": {
    "mode": "rolling",
    "plan": "site/data/ktp-plan.json",
    "state": "site/data/ktp-state.json"
  },
  "lessons": {
    "registry": "site/lesson-registry.js",
    "metadataDir": "site/data/lessons"
  },
  "competencies": {
    "catalog": "site/competency-map-data.js",
    "mastery": "site/mastery-authority.js"
  },
  "practice": {
    "config": null
  }
}
