{
  "version": 2,
  "studentId": "volodia_khachaturian",
  "studentName": "Володя Хачатурян",
  "program": "ОГЭ по физике",
  "planning": {
    "mode": "rolling",
    "plan": "site/data/ktp-plan.json",
    "state": "site/data/ktp-state.json"
  },
  "lessons": {
    "registry": "site/lesson-registry.js",
    "metadataDir": "site/data/lessons"
  },
  "competencies": {
    "catalog": "site/data/competency-catalog.json",
    "mastery": "site/data/mastery-state.json"
  },
  "practice": {
    "config": "site/practice-config.js"
  }
}
